{
	"key": "E",
	"dimension": 0,
	"distanceRenderMarker": 15,
	"areas": [
		{
			"id": "Entrance1",
			"marker": {
				"pos": {
					"x": 0,
					"y": 0,
					"z": 70
				},
				"color": {
					"r": 255,
					"g": 187,
					"b": 255,
					"a": 255
				},
				"size": {
					"x": 2.0,
					"y": 2.0,
					"z": 1.0
				},
				"heading": 169.59108,
				"type": 1
			},
			"spawn": {
				"x": 0,
				"y": 0,
				"z": 73
			},
			"canGoTo": [
				"Room1"
			]
		},
		{
			"id": "Room1",
			"marker": {
				"pos": {
					"x": 0,
					"y": 10,
					"z": 70
				},
				"color": {
					"r": 255,
					"g": 187,
					"b": 255,
					"a": 255
				},
				"size": {
					"x": 2.0,
					"y": 2.0,
					"z": 1.0
				},
				"heading": 169.59108,
				"type": 1
			},
			"spawn": {
				"x": 0,
				"y": 10,
				"z": 73
			}
		}
	]
}